{
  "schema_version": 1,
  "sources": [
    {
      "source_ref": "source:luminet-repository",
      "kind": "repository",
      "locator": "."
    }
  ],
  "path_policies": {
    "generated_roots": [
      "conductor/preservation-ledger/generated"
    ],
    "generated_outputs": [
      {
        "policy_id": "policy:generated-ledger-reports",
        "pattern": "conductor/preservation-ledger/generated/reports/**"
      }
    ],
    "temporary_outputs": [
      {
        "policy_id": "policy:validator-temporary-output",
        "pattern": "tmp/preservation-ledger/**"
      }
    ]
  },
  "families": [
    {
      "family_id": "family:rust-http-relay-mitm-variants",
      "status": "characterized",
      "disposition": "compose",
      "canonical_peer_id": "peer:rust-mitm-fronting-buffer",
      "peers": [
        {
          "peer_id": "peer:rust-mitm-fronting-buffer",
          "source_ref": "source:luminet-repository",
          "path": "src/packages/lumicore/src/proxy/mitm_fronting_buffer.rs",
          "state": "live",
          "role": "canonical bounded flow-control primitive",
          "preserved_details": [
            "64KiB capacity",
            "4KiB chunks",
            "FIFO order",
            "atomic overflow",
            "shutdown metrics"
          ],
          "consumers": [
            "core/src/proxy/mod.rs"
          ],
          "verification_evidence": [
            "cargo test proxy::mitm_fronting_buffer --lib"
          ],
          "disposition": "compose",
          "provenance": {
            "evidence": [
              "repository path and Rust module registration"
            ]
          }
        }
      ],
      "deletion_predicate": "No retirement in this program; require field/default parity and static plus packaged reachability evidence.",
      "field_default_matrix": [
        {
          "field": "buffer_capacity",
          "peer_values": {
            "peer:rust-mitm-fronting-buffer": "65536 bytes"
          },
          "decision": "Retain the bounded primitive default and characterize every adapter override."
        },
        {
          "field": "chunk_size",
          "peer_values": {
            "peer:rust-mitm-fronting-buffer": "4096 bytes"
          },
          "decision": "Retain FIFO chunk behavior as the canonical primitive contract."
        }
      ]
    },
    {
      "family_id": "family:go-mitm-fronting",
      "status": "characterized",
      "disposition": "compose",
      "canonical_peer_id": "peer:go-mitm-bandwidth-shaper",
      "peers": [
        {
          "peer_id": "peer:go-mitm-bandwidth-shaper",
          "source_ref": "source:luminet-repository",
          "path": "labs/daemon/modules/mitm/mitm_fronting_bandwidth_shaper.go",
          "state": "live",
          "role": "Go traffic-policy controller variant",
          "preserved_details": [
            "rate semantics",
            "configuration fields",
            "runtime controller behavior"
          ],
          "consumers": [],
          "verification_evidence": [
            "go test ./internal/proxy"
          ],
          "disposition": "compose",
          "provenance": {
            "evidence": [
              "repository path and package ownership"
            ]
          }
        }
      ],
      "deletion_predicate": "No retirement in this program; every generated helper must delegate and preserve accepted fields and defaults.",
      "field_default_matrix": [
        {
          "field": "rate_limit",
          "peer_values": {
            "peer:go-mitm-bandwidth-shaper": "controller-defined"
          },
          "decision": "Preserve rate semantics behind the composed traffic-policy contract."
        },
        {
          "field": "configuration_defaults",
          "peer_values": {
            "peer:go-mitm-bandwidth-shaper": "constructor-owned"
          },
          "decision": "Capture constructor defaults before any generated wrapper convergence."
        }
      ]
    },
    {
      "family_id": "family:scanner-probe-diagnostics",
      "status": "inventory",
      "disposition": "compose",
      "canonical_peer_id": "peer:scanner-package",
      "peers": [
        {
          "peer_id": "peer:scanner-package",
          "source_ref": "source:luminet-repository",
          "path": "src/apps/daemon/internal/analysis/scanner",
          "state": "live",
          "role": "protocol scanning and diagnostic observations",
          "preserved_details": [
            "protocol observations",
            "partial-result behavior",
            "cancellation boundaries"
          ],
          "consumers": [],
          "verification_evidence": [
            "go test ./internal/scanner"
          ],
          "disposition": "compose",
          "provenance": {
            "evidence": [
              "repository package"
            ]
          }
        }
      ],
      "deletion_predicate": "Preserve every observation type until scheduling, cancellation, and result fixtures prove composition."
    },
    {
      "family_id": "family:warp",
      "status": "inventory",
      "disposition": "canonicalize",
      "canonical_peer_id": "peer:warp-scanner",
      "peers": [
        {
          "peer_id": "peer:warp-scanner",
          "source_ref": "source:luminet-repository",
          "path": "src/apps/daemon/internal/runtime/warp/warp_scanner.go",
          "state": "live",
          "role": "WARP domain scanner",
          "preserved_details": [
            "endpoint probing",
            "registration",
            "partial results"
          ],
          "consumers": [],
          "verification_evidence": [
            "go test ./internal/warp"
          ],
          "disposition": "canonicalize",
          "provenance": {
            "evidence": [
              "repository path"
            ]
          }
        },
        {
          "peer_id": "peer:proxy-warp-scanner",
          "source_ref": "source:luminet-repository",
          "path": "src/apps/daemon/internal/runtime/proxy/warp_scanner.go",
          "state": "historical",
          "role": "retired API-facing WARP registration and endpoint probing adapter",
          "preserved_details": [
            "Cloudflare registration and reserved-byte conversion",
            "legacy WireGuard export fields",
            "configured endpoint and port handling",
            "optional noise and IFPM payload policy",
            "timeout and partial-result reporting"
          ],
          "consumers": [],
          "verification_evidence": [
            "deep-module prune ledger records retirement after canonical WARP ownership converged"
          ],
          "disposition": "quarantine",
          "provenance": {
            "immutable_ref": "sha256:31dd0785dc6a2e0f1af82ca54a1a6ff5859a1245ddf268d7ab4e8cd2f38a2b0a",
            "evidence": [
              "immutable baseline content and deep-module retirement record"
            ]
          }
        }
      ],
      "field_default_matrix": [
        {
          "field": "handshake success evidence",
          "peer_values": {
            "peer:warp-scanner": "Noise IK response validation",
            "peer:proxy-warp-scanner": "WireGuard message-type response with timeout failure"
          },
          "decision": "Canonical WARP ownership requires cryptographic handshake validation; the retired proxy peer remains immutable historical evidence only."
        },
        {
          "field": "registration and export",
          "peer_values": {
            "peer:warp-scanner": "domain scanner options and candidate generation",
            "peer:proxy-warp-scanner": "Cloudflare registration, reserved conversion, and legacy export fields"
          },
          "decision": "Registration and export semantics are owned by the canonical WARP module; the retired proxy peer is not a live adapter."
        }
      ],
      "deletion_predicate": "The canonical WARP peer must retain registration, endpoint, handshake, cancellation, export, and partial-result behavior; the retired proxy peer remains historical evidence."
    },
    {
      "family_id": "family:subscription-ingestion",
      "status": "characterized",
      "disposition": "compose",
      "canonical_peer_id": "peer:subscription-profile-service",
      "peers": [
        {
          "peer_id": "peer:subscription-profile-service",
          "source_ref": "source:luminet-repository",
          "path": "src/apps/daemon/internal/integrations/sub/profile_service.go",
          "state": "live",
          "role": "canonical local profile service",
          "preserved_details": [
            "metadata",
            "snapshot isolation",
            "stale-refresh rejection"
          ],
          "consumers": [
            "server/internal/api/handlers_subscription_profiles.go"
          ],
          "verification_evidence": [
            "go test ./internal/sub -run ProfileService"
          ],
          "disposition": "compose",
          "provenance": {
            "evidence": [
              "repository path and API consumer"
            ]
          }
        }
      ],
      "deletion_predicate": "Parser compatibility, local export, and opt-in fetch policy fixtures must pass; peer retirement is separate."
    },
    {
      "family_id": "family:provider-corpus",
      "status": "inventory",
      "disposition": "canonicalize",
      "canonical_peer_id": "peer:proxy-provider-corpus",
      "peers": [
        {
          "peer_id": "peer:proxy-provider-corpus",
          "source_ref": "source:luminet-repository",
          "path": "labs/daemon/proxy-alternates/provider_corpus.go",
          "state": "live",
          "role": "provider corpus compatibility peer",
          "preserved_details": [
            "schema-v1 compatibility",
            "priority ordering",
            "longest-prefix lookup"
          ],
          "consumers": [],
          "verification_evidence": [
            "go test ./internal/proxy"